{
  "contract_version": "0.2.0",
  "query_id": "q_20260924T101500Z_3fa9c1",
  "frame": {
    "crs_epsg": 32645,
    "origin_x_utm_m": 657810.0,
    "origin_y_utm_m": 3051630.0,
    "vertical_exaggeration": 1.5,
    "vertical_exaggeration_applies_to": "z_axis",
    "units": "m",
    "axis_order": "east,north,up"
  },
  "terrain": {
    "url": "/api/v1/files/teesta/queries/q_20260924T101500Z_3fa9c1/scene3d/terrain.bin",
    "encoding": "float32_le_row_major",
    "width": 500,
    "height": 375,
    "cell_size_x_m": 120.0,
    "cell_size_y_m": 120.0,
    "origin_x_utm_m": 613080.0,
    "origin_y_utm_m": 3092850.0,
    "origin_local_x_m": -44730.0,
    "origin_local_y_m": 41220.0,
    "transform": [120.0, 0.0, 613080.0, 0.0, -120.0, 3092850.0],
    "crs_epsg": 32645,
    "min_elev_m": 1200.0,
    "max_elev_m": 4800.0,
    "nodata": -9999.0,
    "byte_length": 750000
  },
  "flood_surface": {
    "url": "/api/v1/files/teesta/queries/q_20260924T101500Z_3fa9c1/scene3d/flood_surface.bin",
    "encoding": "float32_le_row_major",
    "nodata": -9999.0,
    "basis": "terrain + depth_p50",
    "width": 500,
    "height": 375,
    "byte_length": 750000
  },
  "comparison": {
    "nearfield_bounds_local": [[0.0, 0.0], [7110.0, 4680.0]],
    "delft3d_surface_url": null,
    "delft3d_surface_basis": null,
    "sph_surfaces": []
  },
  "payload_bytes": 1500000,
  "max_payload_mb": 20
}
